{
  "id": "A-03-crystal-ball-narrative",
  "title": "Crystal Ball Narrative",
  "description": "Prompt works that compress a complete story world into a single crystal ball, using refraction, scale, and miniature scenes.",
  "i18n": {
    "en": {
      "title": "Crystal Ball Narrative",
      "description": "Prompt works that compress a complete story world into a single crystal ball, using refraction, scale, and miniature scenes."
    },
    "zh-CN": {
      "title": "水晶球叙事",
      "description": "把完整叙事世界压缩进一颗水晶球，通过折射、尺度和微缩场景呈现。"
    }
  },
  "display": {
    "featured": true,
    "sort_order": 30,
    "audiences": [
      "gallery",
      "research"
    ],
    "tags": [
      "crystal-ball",
      "miniature-world"
    ]
  },
  "packages": [
    {
      "id": "series-crystal-ball-seasons",
      "type": "series",
      "title": "Crystal Ball Seasons",
      "path": "packages/series-crystal-ball-seasons/package.json"
    }
  ]
}
