{
  "id": "A-13-mirror-worlds",
  "title": "Mirror Worlds",
  "description": "A prompt set about showing the same fictional person across different ages, rooms, and timelines.",
  "packages": [
    {
      "id": "series-three-eras",
      "type": "series",
      "title": "Three Eras",
      "path": "packages/series-three-eras/package.json"
    },
    {
      "id": "single-timeline-collision",
      "type": "single",
      "title": "Timeline Collision Hero",
      "path": "packages/single-timeline-collision/package.json"
    }
  ],
  "i18n": {
    "en": {
      "title": "Mirror Worlds",
      "description": "A prompt set about showing the same fictional person across different ages, rooms, and timelines."
    },
    "zh-CN": {
      "title": "镜像世界",
      "description": "一组关于同一虚构人物跨年龄、房间与时间线同框呈现的提示词作品。"
    }
  },
  "display": {
    "featured": true,
    "sort_order": 130,
    "audiences": [
      "gallery",
      "research"
    ],
    "tags": [
      "identity-consistency",
      "time-split"
    ]
  }
}
